title,desc,image,url,source,date,ru_title,ru_desc
「沒有戰爭 台灣就贏」 他這樣批評「主張台灣獨立」,繼19日以「穩健」為由，公開力挺總統蔡英文競選連任後，政大教授陳芳明今天(20日)再度在臉書上以「沒有戰爭，台灣就贏」為題發文，直指「主張台灣獨立，都是在騙取選票」。陳芳明說：「台灣能夠升格成為亞洲重要的國家，完全是憑恃島上的民主生活。台灣可以選舉總統，享有言論自由，台灣也更是亞洲第一個實現婚姻平權,https://newtalk.tw/resize_action2/s.newtalk.tw/album/news/223/5c91f1805bb0e.jpg?imgmax=800,https://newtalk.tw/news/view/2019-03-20/222608,NewTalk.tw,20190321,"«Тайвань победит, если не будет войны, — раскритиковал он, — выступая за независимость Тайваня».","После публичной поддержки кампании по переизбранию президента Цай Инвэнь на основании «постоянства» 19-го числа Чэнь Фанмин, профессор Национального университета Чэнчи, сегодня (20-го числа) снова опубликовал в Facebook статью под заголовком «Тайвань будет победить без войны», прямо указывая на то, что «защита независимости Тайваня — это мошенничество с голосами». Чэнь Фанмин сказал: «Стремление Тайваня стать важной страной в Азии полностью связано с демократической жизнью на острове. Тайвань может избирать президента и пользоваться свободой слова. Тайвань также первым в Азии добился равенства в браке."
民主党总统参选人各持怎样的中国政策?,本周，20名民主党总统参选人在密西根州底特律市展开了为期两晚的第二轮辩论，虽然辩论主要集中于美国国内议题，但中国问题，尤其是美中贸易政策问题还是屡屡出现在参选人的言辞交锋之间。随着选战的推进，各位参选人在中国问题上的立场和政策也在逐步明晰。,https://gdb.voanews.com/196C6134-175D-42AF-AE5B-8F4242E3DBBA_w1200_r1_s.jpg,https://www.voachinese.com/a/democratic-candidates-on-china-20190802/5025458.html,VOA,20190803,Какова политика кандидатов в президенты от Демократической партии в Китае?,"На этой неделе 20 кандидатов в президенты от Демократической партии начали двухдневный второй раунд дебатов в Детройте, штат Мичиган.Хотя дебаты в основном были сосредоточены на внутренних проблемах в Соединенных Штатах, вопросы Китая, особенно вопросы торговой политики США и Китая, неоднократно поднимались. Между риторикой кандидатов. По ходу кампании позиции и политика кандидатов по китайскому вопросу постепенно прояснялись."
非洲豬瘟肆虐 越南獸醫局建議發布緊急狀態,越南的非洲豬瘟疫情迅速蔓延，至今已有 55 個省市淪陷。越南獸醫局表示，疫情可能繼續擴大，將「覆蓋」全國 63 個省市，造成嚴重經濟損失，（政府）可以考慮發布國家緊急狀態。,https://cdn.taronews.tw/files/2018/03/vietnam-1242275_1280.jpg,https://taronews.tw/2019/06/13/370267/,芋傳媒,20190614,"Бушует африканская чума свиней, ветеринарный департамент Вьетнама рекомендует объявить чрезвычайное положение","Эпидемия африканской чумы свиней во Вьетнаме быстро распространилась, и к настоящему времени пострадало 55 провинций и городов. Департамент ветеринарии Вьетнама заявил, что эпидемия может продолжать расширяться и «охватить» 63 провинции и города по всей стране, что приведет к серьезным экономическим потерям, и (правительство) может рассмотреть возможность введения чрезвычайного положения."
國台圖首名駐館作家 王瓊玲分享人間溫暖情事,研究古典小說又擁有多元創作的學者作家王瓊玲，接受國立台灣圖書館特聘擔任首名駐館作家。在戲劇、小說、散文間創作轉換悠然，她分享創作，是想把人間良善溫暖找出來。,https://cdn.taronews.tw/files/2019/08/20190814PHO0095l.jpg,https://taronews.tw/2019/08/14/433800/,芋傳媒,20190815,Первый постоянный писатель China Taiwan Media Ван Цюнлин поделился теплотой мира,"Ван Цюнлин, ученый и писатель, изучающий классические романы и написавший множество произведений, принимает специальное назначение Национальной тайваньской библиотеки в качестве первого писателя-резидента. Неторопливо переключаясь между драмой, романом и прозой, она делилась своим творением, чтобы познать доброту и теплоту в мире."
澎湖糜蝦死亡 水試所研判與季節海潮有關,澎湖馬公中衛海域沿岸昨天有大量糜蝦死亡，水試所澎湖海生中心主任謝恆毅表示，糜蝦屬浮游生物，由於活動力不大，研判在春天季節隨海潮或是獵食者追捕等有關，導致擱淺致死。,https://cdn.taronews.tw/files/2019/03/20190318PHO0074l.jpg,https://taronews.tw/2019/03/18/284460/,芋傳媒,20190319,Гибель шипровой креветки Пэнху связана с сезонным приливом,"Большое количество креветок погибло вчера у берегов Чжунвэй, Магун, Пэнху. Се Хэнъи, директор Центра морской жизни Пэнху Института водных исследований, сказал, что креветки относятся к планктону. Из-за их низкой активности установлено, что они следуют за течением или весной на них охотятся хищники, что приводит к гибели в результате выброса на мель."
抗議、示威都沒用，要如何讓世衛看見台灣？姜冠宇揭露新公民外交計畫,第72屆世界衛生大會（WHA）即將在5月20日召開，儘管英、美、歐盟、加拿大等國家陸續表態聲援台灣與會，但世界衛生組織（WHO）始終維持一貫的回應，沒有兩岸和解就不會邀請台灣。當以外交部為首的政府部會積極呼籲國際促成台灣參加WHA時，去年倚靠集資將我國醫療軟實力帶到日內瓦的一群人, https://image.cache.storm.mg/styles/smg-800x533-fp/s3/media/image/2019/04/12/20190412-070609_U12879_M512480_94c9.jpg?itok=TF6xOO2V,https://www.storm.mg/article/1183869,風傳媒,20190420,"Протесты и демонстрации бесполезны, каким может быть Тайвань для ВОЗ? Цзян Гуаньюй раскрывает новый план гражданской дипломатии","72-я сессия Всемирной ассамблеи здравоохранения (ВАЗ) состоится 20 мая. Хотя Соединенное Королевство, Соединенные Штаты, Европейский союз, Канада и другие страны последовательно выражали свою поддержку участию Тайваня в этой встрече, Всемирная организация здравоохранения (ВОЗ ) всегда поддерживал последовательный ответ.Без примирения по обе стороны пролива не будет никакого Тайваня не будет приглашен. Когда правительственные министерства во главе с Министерством иностранных дел активно призывали международное сообщество содействовать участию Тайваня в ВАЗ, группа людей, которые полагались на сбор средств, чтобы принести медицинскую мягкую силу моей страны в Женеву в прошлом году"
美国“太空部队”提案上交国会,"美国官员表示，五角大厦已于3月1日向国会提案，成立全球第一支“太空部队”。 
 法新社报道说，这是应美国总统川普的要求所采取的作法。 
 依照目前计划，太空部队将是美军的独立军种，但受空军节制。将是美国的第6个",/english/images/rfa-logo-400.jpg,https://www.rfa.org/mandarin/Xinwen/1-03032019124725.html,RFA,20190304,Предложение США о создании космических сил направлено в Конгресс,"Официальные лица США заявили, что 1 марта Пентагон предложил Конгрессу создать первые в мире «космические силы».
 Agence France-Presse сообщило, что это было сделано по просьбе президента США Трампа.
 Согласно текущим планам, Космические силы будут независимой службой вооруженных сил США, но будут контролироваться ВВС. Будет 6-м в Америке"
回应美报告？中国：5个月解救外籍妇女1130名,继美国发布报告指中国人口贩卖情况严重后，中国公安部21日表示，中国与另外5个东南亚国家在一项打击拐卖人口的联合行动中，解救了1100多名被拐卖的外籍妇女和17名儿童。  中国公安部新闻发言人郭林介绍说，近年来，一些,/english/images/rfa-logo-400.jpg,https://www.rfa.org/mandarin/Xinwen/d-06212019143712.html,RFA,20190622,Ответ на доклад США? Китай: за 5 месяцев спасено 1130 иностранок,"После того, как Соединенные Штаты опубликовали отчет, в котором говорится, что ситуация с торговлей людьми в Китае является серьезной, Министерство общественной безопасности Китая заявило 21-го числа, что Китай и пять других стран Юго-Восточной Азии спасли более 1100 женщин-иностранок, ставших жертвами торговли людьми, и 17 человек в совместная операция против торговли людьми ребенок. Го Линь, представитель Министерства общественной безопасности Китая, сказал, что в последние годы некоторые"
堅持原初選制度 羅文嘉：卓榮泰選擇向歷史負責,民進黨總統初選制度僵局未解，民進黨秘書長羅文嘉今天表示，要為黨主席卓榮泰加油，當選擇向歷史與制度負責時，他是感動的，當選擇人煙稀少這條路時，他一定會陪，其實不是因為卓榮泰，因為一樣的信仰。,https://cdn.taronews.tw/files/2019/05/S__25427977.jpg,https://taronews.tw/2019/05/24/350775/,芋傳媒,20190525,Придерживаться первоначальной системы первичных выборов Луо Вэньцзя: Чжо Жунтай решил взять на себя ответственность перед историей,"Тупик в системе первичных президентских выборов ДПП до сих пор не решен.Генеральный секретарь ДПП Луо Вэньцзя заявил сегодня, что он должен поддержать председателя партии Чжо Жунтая.Он был тронут, когда решил нести ответственность за историю и систему.Когда он выбрал малонаселенная дорога Он обязательно будет сопровождать его, когда мы будем вместе, не из-за Чжо Жунтая, а из-за той же веры."
年金改革節省60.7億元 全數挹注退撫基金,公務人員年金改革去年 7 月 1 日上路，銓敘部今天表示， 2018 年下半年度，中央和各地方政府可節省經費合計 60 億 7000 萬餘元，將全數挹注退撫基金，今天已陳報考試院院會審查通過，後續將函請行政院會同確定。,https://cdn.taronews.tw/files/2018/09/20180907PHO0022l.jpg,https://taronews.tw/2019/02/21/261521/,芋傳媒,20190222,"Аннуитетная реформа сэкономила 6,07 млрд юаней, и все они будут вложены в пенсионный фонд.","Пенсионная реформа для государственных служащих началась 1 июля прошлого года.Министерство государственной службы заявило сегодня, что во второй половине 2018 года центральные и местные органы власти могут сэкономить в общей сложности более 6,07 млрд юаней денежных средств, что будут полностью вложены в пенсионный фонд.Отчет был представлен сегодня.Суд рассмотрит и утвердит его, а затем направит письмо в исполнительный юань для подтверждения."
大學申請過一階人次暴增 教團籲調整學測級分,教團今天表示， 2019 年度大學個人申請通過一階篩選人次遠大於預期，可能導致二階甄試錄取率大幅降低，呼籲教育部透過調整學測級分等配套來解決同分增額亂象。,https://cdn.taronews.tw/files/2019/03/20190331PHO0045l.jpg,https://taronews.tw/2019/03/31/296499/,芋傳媒,20190401,Резко увеличилось количество абитуриентов,"Религиозная группа заявила сегодня, что количество отдельных абитуриентов, прошедших первый этап отбора в 2019 году, было намного больше, чем ожидалось, что может привести к резкому падению уровня приема на второй этап отбора."
新新聞》「貨出人進」政績有點虛，韓國瑜棄市長選總統正當性不足,國民黨主席吳敦義保留總統提名人二階段徵召可能，讓高雄市長韓國瑜選總統的話題持續延燒。對此，地方認為，韓國瑜在地方上必須奠定影響長遠的政績，才能抵銷日後對手的「相罵本」。據ＴＶＢＳ二月二十一日發布民調，高達五六％高雄人不支持韓國瑜選總統。「若韓市長當不滿兩百天就要去選，對投給他的高, https://image.cache.storm.mg/styles/smg-800x533-fp/s3/media/image/2019/03/06/20190306-032425_U8719_M503604_ff93.JPG?itok=qkpFlIOE,https://www.storm.mg/article/1029651,風傳媒,20190307,"«Новые новости» «Товары приходят, а люди приходят» политические достижения немного фальшивы, а отказ Хань Гоюй от мэра баллотироваться на пост президента недостаточно законен.","Председатель Гоминьдана У Дуньи зарезервировал возможность второго этапа объявления кандидата в президенты, что продолжало разжигать тему президентских выборов мэра Гаосюна Хань Го-юя. В связи с этим местное правительство считает, что Хань Гоюй должен установить долгосрочные политические достижения на местном уровне, чтобы в будущем нивелировать «криминальную базу» своих противников. Согласно опросу, опубликованному TVBS 21 февраля, целых 56% жителей Гаосюна не поддерживают избрание Хань Го-юя президентом. «Мэр Руохан будет избран менее чем через 200 дней."
共軍遼寧號通過台海北返  國防部：全程掌控,國防部今天針對共軍航空母艦遼寧號通過台灣海峽北返表示，期間國軍運用聯合情監偵均能全程掌控與應處，確保國家安全與區域穩定，籲請國人放心。蘋果日報今天報導，共軍航空母艦遼寧號及護航編隊通過東沙島附近海域，根據遼寧號的航速計算，預計晚上即可駛出台灣海峽，返回青島母港，完成遼寧號去年大修後的首次繞台航訓。國,https://newtalk.tw/resize_action2/s.newtalk.tw/album/news/122/5ad8211b969e1.jpg?imgmax=800,https://newtalk.tw/news/view/2019-06-25/264345,NewTalk.tw,20190626,Коммунистическая армия Ляонин прошла через Тайвань и вернулась к Министерству национальной обороны: полный контроль,"Министерство национальной обороны заявило сегодня, что коммунистический авианосец ""Ляонин"" вернулся на север через Тайваньский пролив.В этот период национальная армия использовала совместную разведку, наблюдение и рекогносцировку для контроля и реагирования на протяжении всего процесса для обеспечения национальной безопасности и региональной стабильности. Apple Daily сообщила сегодня, что авианосец НОАК «Ляонин» и флот его сопровождения прошли воды вблизи острова Дунша.Согласно расчетам, основанным на скорости «Ляонина», ожидается, что вечером он выйдет из Тайваньского пролива и вернется в Циндао. порт. страна"
美忧北约系统遭骇 促德勿用华为5G,美国周一警告德国，5G网路若使用「不受信任的供应商」将带来风险，试图以可能影响双方情报分享向德国施压。如今，因5G而限制情报分享的规模可能扩及北大西洋公约联盟。,https://www.dw.com/image/47803852_7.jpg,https://www.dw.com/zh/%E7%BE%8E%E5%BF%A7%E5%8C%97%E7%BA%A6%E7%B3%BB%E7%BB%9F%E9%81%AD%E9%AA%87-%E4%BF%83%E5%BE%B7%E5%8B%BF%E7%94%A8%E5%8D%8E%E4%B8%BA5g/a-47863811?maca=chi-rss-chi-all-1127-rdf,DW,20190315,США призывают Германию не использовать Huawei 5G на фоне взлома НАТО,"В понедельник Соединенные Штаты предупредили Германию о рисках использования «ненадежных поставщиков» для своей сети 5G в попытке оказать давление на Германию, угрожая обмену разведданными между двумя сторонами. Теперь ограничения на обмен разведданными из-за 5G могут распространиться на альянс НАТО."
预测你未来健康状况的无形警告,事实证明，人工智能可以在我们之前发现疾病的预兆。利亚·卡明斯基是一名全科医生和作家，她认为这项技术可能会带领我们进入医疗保健的新时代。,https://ichef.bbci.co.uk/news/1024/branded_ukchina/141DD/production/_105379328_p06y8n7x.jpg,https://www.bbc.com/ukchina/simp/vert-fut-47038870,BBC,20190129,"Невидимые предупреждения, которые предсказывают ваше будущее здоровье","Оказывается, искусственный интеллект может обнаружить предупреждающие признаки болезни раньше нас. Лия Камински, врач общей практики и автор, считает, что технология может привести нас к новой эре здравоохранения."
杨莅--抽身水疗生意俏，却见政坛风浪高,20年前，东北姑娘杨莅怀揣着“美国梦”漂洋过海。后来她成为美国公民，在佛罗里达州创办水疗按摩店，参加社区活动，出入有美国政界名流亮相的场合，并在社交媒体上自豪地登出她与美国总统特朗普的合影。,https://gdb.voanews.com/21FEFE0D-A1A2-446F-BBAA-73CB0E696BE1_cx0_cy4_cw0_w1200_r1_s.jpg,https://www.voachinese.com/a/cindy-yang-20190329/4854310.html,VOA,20190330,"Ян Лай – бизнес в области экстракционных спа-центров процветает, но политическая нестабильность высока","Двадцать лет назад Ян Лай, девушка из Северо-Восточного Китая, путешествовала через океан с «американской мечтой» на руках. Позже она стала гражданкой США, открыла спа-салон и массажный салон во Флориде, участвовала в общественных мероприятиях, посещала мероприятия, на которых выступали американские политические знаменитости, и с гордостью размещала свою фотографию с президентом Трампом в социальных сетях."
胃癌患者接受免疫療法 緩解症狀,67 歲張姓婦人罹患胃癌末期，手術切除部分胃後，接受化學治療，病情起伏藥物未能控制，因腸阻塞無法進食、喝水，後採用免疫療法，經 1 年治療，癌症指數獲得控制，症狀緩解。,https://cdn.taronews.tw/files/2018/05/hospital-3089884_1280.jpg,https://taronews.tw/2019/03/27/292527/,芋傳媒,20190328,Больные раком желудка получают иммунотерапию для облегчения симптомов,"67-летняя женщина по фамилии Чжан страдала терминальным раком желудка.После хирургической резекции части желудка ей была проведена химиотерапия.Подъемы и спады ее состояния не контролировались лекарствами, и она не могла ни есть, ни пить из-за к кишечной непроходимости.Затем была применена иммунотерапия.Через 1 год лечения раковый индекс удалось контролировать.Симптомы купировались."
