title,desc,image,url,source,date,ru_title,ru_desc
凌晨在南投民宿被查獲！鼓吹武統學者李毅上午7：25遣返香港,內政部移民署今天表示，由於中國學者李毅未依限離境，將由移民署人員於上午7時25分執行強制出境，於桃園機場搭CI-601班機離境前往香港。曾鼓吹武力統一台灣的中國學者李毅受中國和平統一促進會邀請訪台演講，但移民署昨天表示，李毅9日持觀光簽證入境台灣，不得發表演說，已廢止李毅入境許可，限令昨天出境。移民,https://newtalk.tw/resize_action2/s.newtalk.tw/album/news/233/5cafde0d87d03.png?imgmax=800,https://newtalk.tw/news/view/2019-04-12/232323,NewTalk.tw,20190413,"Его забрали в гостевом доме Наньтоу рано утром! Ли И, ученый, выступавший за объединение военных, был репатриирован в Гонконг в 7:25 утра.","Департамент иммиграции Министерства внутренних дел заявил сегодня, что, поскольку китайский ученый Ли И не покинул страну в установленные сроки, сотрудники Департамента иммиграции осуществят принудительную депортацию в 7:25 утра и покинут страну в рейс CI-601 в аэропорту Таоюань в Гонконге. Ли И, китайский ученый, который когда-то выступал за воссоединение Тайваня силой, был приглашен Китайской ассоциацией содействия мирному воссоединению, чтобы выступить на Тайване, однако вчера Департамент иммиграции заявил, что Ли И прибыл на Тайвань с туристом. Виза 9-го числа, и ему не разрешили выступить с речью. Разрешение на въезд Ли И было отменено. Покинуть страну. мигрант"
科技防灾：预测自然灾害的人工智能新技术,地震、海啸、洪水和森林火灾都是难以控制且破坏极大的自然灾害，人工智能领域的进展有助于预测灾害的发生。,https://ichef.bbci.co.uk/news/1024/branded_ukchina/51E3/production/_106136902_p0720fh6.jpg,https://www.bbc.com/ukchina/simp/vert-fut-47669454,BBC,20190323,Предотвращение техногенных катастроф: новая технология искусственного интеллекта для прогнозирования стихийных бедствий,"Землетрясения, цунами, наводнения и лесные пожары — это неуправляемые и разрушительные стихийные бедствия, и достижения в области искусственного интеллекта могут помочь предсказать их возникновение."
欧盟探索如何对抗中国式“国家资本主义”,围绕中国政府所支持的“国家资本主义”的担忧正促使欧盟重新评估其竞争法规，以备批准大型并购交易之用或对外国竞争者做出更强有力的回应。,https://si.wsj.net/public/resources/images/S1-BS166_euchin_G_20190115121646.jpg,https://cn.wsj.com/articles/%E6%AC%A7%E7%9B%9F%E6%8E%A2%E7%B4%A2%E5%A6%82%E4%BD%95%E5%AF%B9%E6%8A%97%E4%B8%AD%E5%9B%BD%E5%BC%8F%E2%80%9C%E5%9B%BD%E5%AE%B6%E8%B5%84%E6%9C%AC%E4%B8%BB%E4%B9%89%E2%80%9D-11547606412?tesla=y,WSJ,20190116,"ЕС изучает, как противостоять «государственному капитализму» в китайском стиле","Обеспокоенность по поводу «государственного капитализма», поддерживаемого китайским правительством, побуждает Европейский союз пересматривать свои правила конкуренции в рамках подготовки к одобрению крупных сделок по слиянию или более жесткому реагированию на иностранных конкурентов."
韓國瑜：中天報導這麼多中華民國國旗，怎麼可能賣台？,英國《金融時報》報導，旺中集團媒體的新聞受到中國國台辦指令，高雄市長韓國瑜今（19）日被中天記者詢問對此看法時表示，「中天報導這麼多中華民國國旗，怎麼可能賣台？或者被國台辦的指揮呢？我不太了解NCC的…,https://image.peoplenews.tw/news/2d487f39-e89b-4e2e-8f31-b9989c99aa5a.jpg,https://www.peoplenews.tw/news/2d487f39-e89b-4e2e-8f31-b9989c99aa5a,民報,20190720,"Хань Гоюй: Чжунтянь сообщил о таком количестве национальных флагов Китайской Республики, как можно было продать Тайвань?","Британская ""Financial Times"" сообщила, что новости СМИ Wangzhong Group были заказаны Управлением по делам Тайваня Государственного совета Китая. Репортер Zhongtian сегодня (19-го) спросил мэра Гаосюна Хань Гоюя об этом, и он сказал: ""Zhongtian сообщает, что много флагов Китайской Республики.Как можно было продавать Тайвань?Или управляться Управлением по делам Тайваня Госсовета?Я мало знаю о NCC..."
糗大！疑似忘切帳號  沈智慧自誇「立院清流」網友虧慘,臉書忘記切換帳號留言被抓包出糗，昨天再添一樁！有網友發現，國民黨台中市新科立委沈智慧，疑似在臉書「老王賣瓜」，自誇是「立法院一股清流」，但忘了「轉換身分」。雖然她發現搞了烏龍後，已將留言刪除，但仍被眼尖的網友秒截圖為證，除迅速洗版外，並在PTT掀起熱議和嘲諷，好不尷尬！沈智慧在自己臉書下方留言表示，,https://newtalk.tw/resize_action2/s.newtalk.tw/album/news/217/5c81ba1172a8d.jpg?imgmax=800,https://newtalk.tw/news/view/2019-03-08/216863,NewTalk.tw,20190309,"Большое смущение! Подозреваемый в том, что он забыл удалить аккаунт, Шэнь Чжихуэй хвастался, что пользователи сети «Лиюань Цинлю» ужасно пострадали.","Facebook забыл сменить аккаунт и оставил сообщение, и был пойман от смущения Вчера добавилось еще одно! Некоторые пользователи сети обнаружили, что Шэнь Чжихуэй, депутат новой ветви города Тайчжун гоминьдана, подозревается в «продаже дынь Лао Ваном» на Facebook, хвастаясь тем, что он «чистый поток в Законодательном юане», но забыл « изменить свою личность». Несмотря на то, что она удалила свое сообщение после того, как узнала, что сделала что-то не так, зоркие пользователи сети все равно сделали скриншоты, которые помимо быстрой очистки версии вызвали бурные обсуждения и насмешки на PTT, так неловко! Шэнь Чжихуэй оставила сообщение под своим Facebook, сказав:"
見證台灣400年歷史：這裏曾經是荷蘭人的熱蘭遮城,臺灣城殘蹟 現今為一級古蹟 當年外城的南側城壁台灣城南面城牆 壁史陳述歷史的興衰,https://www.cmmedia.com.tw/file/24832/1555033057_100102_cropped_99_1555032701_100102_main_448A5498-1.jpg,https://www.cmmedia.com.tw/home/articles/15095,信傳媒,20190415,Станьте свидетелем 400-летней истории Тайваня: когда-то это был голландский город Зеландия.,Остатки Тайваньского города теперь являются первоклассным историческим местом.Южная стена внешнего города была южной стеной Тайваньского города.История стены описывает взлеты и падения истории.
美国之音中文网 您可靠的信息来源,"美国之音是您的可靠和准确的有关中国、美国和国际新闻的来源。欢迎浏览美国之音中文网阅读最新的报道，收听收看美国之音电视广播节目或练习您的英语。
Voice of America Chinese is your source for reliable and accurate news about China, the United States and the World. Read the latest news, watch VOA TV, listen to one of our radio programs or practice your English.",https://www.voachinese.com/Content/responsive/VOA/img/top_logo_news.png,https://www.voachinese.com/,VOA,20190124,Голос Америки Китайский сайт Ваш надежный источник информации,"«Голос Америки» — ваш надежный и точный источник китайских, американских и международных новостей. Добро пожаловать на китайский веб-сайт VOA, чтобы читать последние отчеты, слушать передачи VOA TV или практиковать свой английский.
Голос Америки на китайском – ваш источник достоверных и точных новостей о Китае, Соединенных Штатах и ​​мире. Читайте последние новости, смотрите VOA TV, слушайте одну из наших радиопрограмм или практикуйте свой английский."
單桿破百1000次！英格蘭司諾克「火箭人」奧蘇利文創造難以超越的歷史紀錄,在全世界最受歡迎的撞球運動「司諾克」之中，一位選手「單桿破百」的次數是衡量其技術水平的最重要指標之一。英格蘭司諾克大師「火箭人」奧蘇利文10日就此創下前無古人、日後也難有來者的紀錄：完成職業生涯第1000次「單桿破百」，而且他今年才43歲！司諾克（snooker）職業撞球員錦標賽, https://image.cache.storm.mg/styles/smg-800x533-fp/s3/media/image/2019/03/14/20190314-071850_U720_M505769_e77e.jpg?itok=BJhG9cy9,https://www.storm.mg/article/1058536,風傳媒,20190315,"Сломайте 1000 раз одним ударом! Англия Снукер ""Рокетмен"" О'Салливан устанавливает непревзойденный исторический рекорд","В самой популярной в мире игре в бильярд «снукер» количество раз, когда игрок «выбивает 100 за один удар», является одним из наиболее важных показателей для измерения его технического уровня. Мастер снукера Англии ""Rocket Man"" О'Салливан установил беспрецедентный рекорд 10-го числа, и в будущем ему будет трудно кому-либо прийти: он совершил 1000-й ""сингл-брейк"" в своей карьере, а ему всего 43 года. старый в этом году! Чемпионат профессиональных игроков в снукер"
紀念6．3血腥鎮壓40天 蘇丹再現示威潮,目擊者指出，蘇丹各地 13 日有數以萬計的示威者走上街頭，以紀念數十名抗議群眾 40 天前，在首都喀土木（Khartoum）遭到安全部隊殺害。,https://cdn.taronews.tw/files/2019/06/1067x600_216263774438.jpg,https://taronews.tw/2019/07/14/401731/,芋傳媒,20190715,В ознаменование 40 дней кровавых репрессий 3 июня в Судане вновь вспыхивают протесты,"Свидетели сообщили, что в среду десятки тысяч демонстрантов вышли на улицы Судана в память об убийстве десятков протестующих силами безопасности в столице Хартуме 40 дней назад."
列车进站时 男子打后空翻,法国一个年轻人日前在法国的火车站月台进行惊险挑战，他在列车进站时，千钧一发的瞬间打后空翻。网民怒轰他罔顾他人安危。这个24岁的男生Rapha?l Bourgeat-lami在社交网站Instagram上载在不同的地方打空翻表演的影片，包括在高楼大厦的边沿、滑板场、大树旁等等高危地方进行动作，而近日他在法国巴黎的一个车站月台的“表演”，引起一些人怒轰。,https://www.zaobao.com.sg/sites/default/files/styles/og_share_medium/public/images/201901/20190129/file73ub8he9p9137sh48h2.jpg?itok=fPntGNx8&c=79d357050ab5f484f99d5bd27651dd1a,https://www.zaobao.com.sg/znews/others/story20190129-928069?utm_medium=Social&utm_source=Facebook#Echobox=1548744967,Zaobao,20190130,"Мужчина делает сальто назад, когда поезд подъезжает к станции","Молодой человек во Франции недавно выполнил захватывающее испытание на платформе французского железнодорожного вокзала: когда поезд въехал на станцию, в критический момент он сделал сальто назад. Пользователи сети раскритиковали его за игнорирование безопасности других. 24-летний мальчик Рафаэль Бурже-лами загрузил видео сальто в разных местах в социальной сети Instagram, в том числе выполняя действия в местах повышенного риска, таких как край высотных зданий, площадки для катания на скейтборде и т. д. «Выступление» на платформе вокзала в Париже, Франция, вызвало гнев некоторых людей."
波蘭逮涉間諜罪員工 華為：進行調查不便評論,針對波蘭媒體指稱，一名華為中國籍員工因涉間諜活動遭逮捕，華為公司今（11）日回應表示，目前正對此進行調查，不便評論，並強調，一直要求所有員工遵守所在國法律法規。中國電訊設備巨頭華為近年風波不斷，國際社會質疑協助中國政府進行企業間諜活動，因此受到美、日和英等多國封殺，阻撓參與5G網絡建設，面臨外界越來,https://newtalk.tw/resize_action2/s.newtalk.tw/album/news/194/5c38b3e76f0e4.jpg?imgmax=800,https://newtalk.tw/news/view/2019-01-11/193425,NewTalk.tw,20190112,"Польша арестовывает сотрудников, причастных к шпионажу, Huawei: расследование неудобно комментировать","В ответ на утверждения польских СМИ о том, что китайский сотрудник Huawei был арестован за шпионаж, Huawei ответила сегодня (11-го числа), что в настоящее время расследует это и не может комментировать. В последние годы у китайского гиганта телекоммуникационного оборудования Huawei возникли проблемы, и международное сообщество поставило под сомнение его помощь китайскому правительству в корпоративном шпионаже."
郭董的鬼使神差,鴻海董事長郭台銘參加國民黨總統的初選。以郭董的民望，已經是牽動三尺浪，然而他不以此為滿足，為了讓事情更加完美，他製造的出場式，可謂前無古人，擺出一副「天子」的架勢，至少也是帶著天命的御旨，下凡行事。不…,https://image.peoplenews.tw/news/e925a5f0-4fa5-4a26-8a90-79849c604e56.png,https://www.peoplenews.tw/news/e925a5f0-4fa5-4a26-8a90-79849c604e56,民報,20190419,Непонимание Дун Го,"Председатель Хон Хай Терри Гоу участвовал в первичных президентских выборах Гоминьдана. Популярность Го Дуна уже затронула волны в три фута, но он не удовлетворен этим. Чтобы сделать вещи более совершенными, он создал беспрецедентный вид. Следуя императорскому указу судьбы, он приступил к действию. Нет…"
臺灣是地區不是國家? 林濁水批楊惠欽回答沒擔當,民進黨前立委林濁水今(1)日稍早於社群媒體臉書發文，直指大法官被提名人楊惠欽日前被問到「臺灣是不是一個國家？」時，回答得相當沒骨氣、沒擔當，「當偽大法官也真是適格得很」。大法官被提名人楊惠欽日前接受無黨籍立委陳玉珍詢問，被問及「臺灣是否為國家？」時表示，「我們是中華民國，臺灣這兩個字應該沒有出現在《,https://newtalk.tw/resize_action2/s.newtalk.tw/album/news/88/5bfba8b181582.jpg?imgmax=800,https://newtalk.tw/news/view/2019-07-01/266962,NewTalk.tw,20190702,"Тайвань — это регион, а не страна? Линь Чжошуй критикует Ян Хуэйцинь за то, что он не взял на себя ответственность","Линь Чжуошуй, бывший депутат от Демократической прогрессивной партии, сегодня опубликовал пост в социальной сети Facebook (1), отметив, что когда кандидата Ян Хуэйциня спросили: «Является ли Тайвань страной?», его ответ был довольно бесхребетным: «Нет». ответственности: «Это действительно право быть псевдосудьей». Кандидат в судьи Ян Хуэйцинь несколько дней назад был допрошен беспартийным депутатом Чэнь Юйчжэнем. Когда его спросили: «Является ли Тайвань страной?», он ответил: «Мы — Китайская Республика."
梅克爾：華為參與德國5G條件 須確保安全無虞,德國總理梅克爾今天表示，德國有必要確保中國電訊設備供應商華為技術公司不會將資料交給中國政府，才能允許華為參與德國第 5 代行動通訊技術（ 5 G）的架設工作。,https://cdn.taronews.tw/files/2019/01/20181227PHO0100l.jpg,https://taronews.tw/2019/02/05/246708/,芋傳媒,20190206,Меркель: участие Huawei в условиях 5G в Германии должно обеспечить безопасность,"Канцлер Германии Ангела Меркель заявила сегодня, что Германии необходимо обеспечить, чтобы китайский поставщик телекоммуникационного оборудования Huawei Technologies не передал информацию китайскому правительству, прежде чем разрешить Huawei участвовать в создании немецкой технологии мобильной связи пятого поколения (5G)."
美国会众议院未能推翻特朗普的否决令,美国国会众议院26日就总统特朗普否决国会两院叫停美墨边境“国家紧急状态”决议举行投票，但未能获得足够票数推翻这个否决令。新华社报道，当天有14名共和党国会众议员加入民主党阵营，投票支持推翻特朗普的否决令。最终投票结果是248票赞成、181票反对，未能达到推翻否决令所需的至少290张赞成票。,https://www.zaobao.com.sg/sites/default/files/styles/og_share_medium/public/images/201903/20190327/cheowml201903270701201.jpg?itok=X36seMX-,https://www.zaobao.com.sg/realtime/world/story20190327-943512?utm_medium=social&utm_source=facebook#echobox=1553642298,Zaobao,20190327,Палата представителей США не может преодолеть вето Трампа,"26-го числа Палата представителей США провела голосование по вето президента Трампа на резолюцию обеих палат Конгресса о приостановке «чрезвычайного положения в стране» на границе США и Мексики, но не набрала достаточно голосов, чтобы отменить вето. Агентство Синьхуа сообщило, что 14 республиканских членов Конгресса присоединились в тот день к лагерю демократов и проголосовали за отмену вето Трампа. В итоге было подано 248 голосов против 181, что меньше минимума в 290 голосов, необходимых для отмены вето."
希臘風建築吸睛 漁港旁活動中心成景點,台南市將軍區鯤鯓、鯤溟里聯合活動中心位於青山漁港旁，以藍白色調為主的希臘風格建築特色，成為遊客必訪景點。近來地方以古地名「青鯤鯓」行銷特產，希望爭取活動中心改名。,https://cdn.taronews.tw/files/2018/06/piraeus-1712115_1280.jpg,https://taronews.tw/2019/02/24/263234/,芋傳媒,20190225,"Архитектура в греческом стиле привлекает внимание, а центр развлечений рядом с рыбацким портом стал живописным местом.",Совместный центр деятельности Кунша и Куньминли в районе Цзянцзюнь города Тайнань расположен рядом с рыбным портом Циншань.Сине-белые тона архитектурных элементов в греческом стиле делают его обязательным для посещения туристами. В последнее время местный рынок использует древнее название «Цинкуньси» для продажи специальных продуктов и надеется изменить название центра деятельности.
觀賞麥寮興華國小動畫片 蔡總統：放臉書分享,雲縣麥寮興華國小僅有學生 45 人，由公視團隊輔導製作「糖果工廠的秘密」反思家鄉環境的動畫片，獲得國內外大獎，總統蔡英文今天訪視觀賞後說，要放臉書擴大分享。,https://cdn.taronews.tw/files/2019/02/20190219PHO0143l.jpg,https://taronews.tw/2019/02/19/259210/,芋傳媒,20190220,Посмотрите анимацию президента начальной школы Майляо Синхуа Цая: поделитесь ею на Facebook,"В начальной школе Майляо Синхуа в уезде Юньсянь учится всего 45 учеников. Команда PTV руководила производством «Секретов кондитерской фабрики», чтобы отразить окружающую среду родного города. Мультфильм получил отечественные и зарубежные награды. Книга расширяется, чтобы поделиться ."
